SNOMEDCTCodes,Description
396230008,Dermatomyositis (disorder)
402425006,Adult onset dermatomyositis (disorder)
281358000,Idiopathic dermatomyositis (disorder)
1144911007,Calcinosis due to adult type dermatomyositis (disorder)
1153408000,Calcification of muscle due to adult dermatomyositis (disorder)
838366009,Anti-synthetase syndrome due to dermatomyositis (disorder)
46696008,Dilated cardiomyopathy due to dermatomyositis (disorder)
403635000,Drug-induced dermatomyositis (disorder)
296241000119107,Disorder of respiratory system due to dermatomyositis (disorder)
